{
  "schemaVersion": "rc5-2-maya-wave-1-pdd-finality-response-v1",
  "sourceDocument": {
    "documentId": "quick-check-review-question",
    "documentName": "12-maya-forest-corridor-redd-belize.pdf",
    "contentSha256": "407caaa782e9d9e07b250999539fc809c2c41888b0f20a628a9e49dbeb977a5b"
  },
  "machineProposalRef": {
    "path": "tests/fixtures/preverif/maya-forest-corridor-redd-belize-live/machine-proposal.json",
    "sha256": "e996de2eef1fc80aefa94e723903049ae4451fb161baccf337750694a394479b",
    "proposalState": "MACHINE_PROPOSED"
  },
  "decisions": [
    {
      "stableRuleId": "Verra.AFOLU.VM0007.v1-8.R-2-0007",
      "machineRowSha256": "4d5bee651a61f80324f1037a477e486814853587af6214b1fb9e648266aca40e",
      "reviewStatus": "PENDING_INDEPENDENT_ADJUDICATION",
      "expertReviewRequired": false,
      "finalEvidenceState": null,
      "finalApplicability": null,
      "reviewerOutcome": null,
      "acceptedEvidence": [],
      "rejectedEvidence": [],
      "contradictionState": null,
      "draftFindingCandidate": null,
      "assessmentReason": null,
      "gap": null,
      "clientAction": null,
      "correctionReason": null,
      "genericFailureCategory": null,
      "reviewerConfidence": null,
      "provisionalReason": null
    },
    {
      "stableRuleId": "Verra.AFOLU.VM0007.v1-8.R-2-0008",
      "machineRowSha256": "d754f9125ed4de837097397f213c6356c8002bfb71bc9b1eaff926735cecec89",
      "reviewStatus": "PENDING_INDEPENDENT_ADJUDICATION",
      "expertReviewRequired": false,
      "finalEvidenceState": null,
      "finalApplicability": null,
      "reviewerOutcome": null,
      "acceptedEvidence": [],
      "rejectedEvidence": [],
      "contradictionState": null,
      "draftFindingCandidate": null,
      "assessmentReason": null,
      "gap": null,
      "clientAction": null,
      "correctionReason": null,
      "genericFailureCategory": null,
      "reviewerConfidence": null,
      "provisionalReason": null
    },
    {
      "stableRuleId": "Verra.AFOLU.VM0007.v1-8.R-3-0001",
      "machineRowSha256": "b00338bf5bf112bfa651e04fd57cf6b07a602f5b4ccbe70c840e943ddfddb9fb",
      "reviewStatus": "PENDING_INDEPENDENT_ADJUDICATION",
      "expertReviewRequired": false,
      "finalEvidenceState": null,
      "finalApplicability": null,
      "reviewerOutcome": null,
      "acceptedEvidence": [],
      "rejectedEvidence": [],
      "contradictionState": null,
      "draftFindingCandidate": null,
      "assessmentReason": null,
      "gap": null,
      "clientAction": null,
      "correctionReason": null,
      "genericFailureCategory": null,
      "reviewerConfidence": null,
      "provisionalReason": null
    },
    {
      "stableRuleId": "Verra.AFOLU.VM0007.v1-8.R-3-0003",
      "machineRowSha256": "0d320b90c174f31a375c4856b6476cafbddc49ea51db02e48bbd3c3ad25d88ec",
      "reviewStatus": "PENDING_INDEPENDENT_ADJUDICATION",
      "expertReviewRequired": false,
      "finalEvidenceState": null,
      "finalApplicability": null,
      "reviewerOutcome": null,
      "acceptedEvidence": [],
      "rejectedEvidence": [],
      "contradictionState": null,
      "draftFindingCandidate": null,
      "assessmentReason": null,
      "gap": null,
      "clientAction": null,
      "correctionReason": null,
      "genericFailureCategory": null,
      "reviewerConfidence": null,
      "provisionalReason": null
    },
    {
      "stableRuleId": "Verra.AFOLU.VM0007.v1-8.R-3-0004",
      "machineRowSha256": "a7361c35261093f78a26b645ec9bf0d76c191ff190950aaa00b309ef68be3d48",
      "reviewStatus": "PENDING_INDEPENDENT_ADJUDICATION",
      "expertReviewRequired": false,
      "finalEvidenceState": null,
      "finalApplicability": null,
      "reviewerOutcome": null,
      "acceptedEvidence": [],
      "rejectedEvidence": [],
      "contradictionState": null,
      "draftFindingCandidate": null,
      "assessmentReason": null,
      "gap": null,
      "clientAction": null,
      "correctionReason": null,
      "genericFailureCategory": null,
      "reviewerConfidence": null,
      "provisionalReason": null
    },
    {
      "stableRuleId": "Verra.AFOLU.VM0007.v1-8.R-3-0008",
      "machineRowSha256": "e8d035dcec8cd8134998c06108db852dd538cb5426a350331cb7f0b9a13bec70",
      "reviewStatus": "PENDING_INDEPENDENT_ADJUDICATION",
      "expertReviewRequired": false,
      "finalEvidenceState": null,
      "finalApplicability": null,
      "reviewerOutcome": null,
      "acceptedEvidence": [],
      "rejectedEvidence": [],
      "contradictionState": null,
      "draftFindingCandidate": null,
      "assessmentReason": null,
      "gap": null,
      "clientAction": null,
      "correctionReason": null,
      "genericFailureCategory": null,
      "reviewerConfidence": null,
      "provisionalReason": null
    },
    {
      "stableRuleId": "Verra.AFOLU.VM0007.v1-8.R-4-0001",
      "machineRowSha256": "d71df8eb1bc5acc9dad82d3db7e9808117ca56678d2700769ed61b221bd1c8a8",
      "reviewStatus": "PENDING_INDEPENDENT_ADJUDICATION",
      "expertReviewRequired": false,
      "finalEvidenceState": null,
      "finalApplicability": null,
      "reviewerOutcome": null,
      "acceptedEvidence": [],
      "rejectedEvidence": [],
      "contradictionState": null,
      "draftFindingCandidate": null,
      "assessmentReason": null,
      "gap": null,
      "clientAction": null,
      "correctionReason": null,
      "genericFailureCategory": null,
      "reviewerConfidence": null,
      "provisionalReason": null
    },
    {
      "stableRuleId": "Verra.AFOLU.VM0007.v1-8.R-5-0003",
      "machineRowSha256": "804cad0063297d5f5346a2b318d76e90b2d77a141f44572b93b7d24ae05d5376",
      "reviewStatus": "PENDING_INDEPENDENT_ADJUDICATION",
      "expertReviewRequired": false,
      "finalEvidenceState": null,
      "finalApplicability": null,
      "reviewerOutcome": null,
      "acceptedEvidence": [],
      "rejectedEvidence": [],
      "contradictionState": null,
      "draftFindingCandidate": null,
      "assessmentReason": null,
      "gap": null,
      "clientAction": null,
      "correctionReason": null,
      "genericFailureCategory": null,
      "reviewerConfidence": null,
      "provisionalReason": null
    }
  ]
}
